{
  "schema": "https://primedirective.dev/schemas/ai-conscience/revocations/v1",
  "issued_at": "2026-09-02T00:00:00Z",
  "entries": [
    {
      "id": "UPD-2026-T9003",
      "kind": "attestation",
      "revoked_at": "2026-09-02T00:00:00Z",
      "reason": "forfeit"
    }
  ],
  "signed_by_fingerprint": "f5e898bb83e13cd6",
  "signature": "dGFtcGVyZWQtcmV2b2NhdGlvbi1zaWduYXR1cmU="
}
